{
  "id": 1,
  "name": "Ada Lovelace Updated",
  "username": "ada.lovelace",
  "email": "ada.updated@example.com",
  "address": {
    "street": "Analytical Ave",
    "suite": "Suite 2",
    "city": "Loveland",
    "zipcode": "12345-6789",
    "geo": {
      "lat": "0.0000",
      "lng": "0.0000"
    }
  },
  "phone": "1-555-000-0001",
  "website": "ada.example.com",
  "company": {
    "name": "REST Assured Inc",
    "catchPhrase": "Testing the untestable, updated",
    "bs": "synergize scalable schemas"
  }
}
